{
  "$schema": "./tokens.schema.json",
  "meta": {
    "name": "Metro Backoffice UI Fallback",
    "version": "1.0.0",
    "profile": "backoffice",
    "baseUnit": 4
  },
  "color": {
    "palette": {
      "primary": {
        "50": "#EFF6FF",
        "100": "#DBEAFE",
        "200": "#BFDBFE",
        "300": "#93C5FD",
        "400": "#60A5FA",
        "500": "#3B82F6",
        "600": "#2563EB",
        "700": "#1D4ED8",
        "800": "#1E40AF",
        "900": "#1E3A8A"
      },
      "neutral": {
        "0": "#FFFFFF",
        "50": "#F9FAFB",
        "100": "#F3F4F6",
        "200": "#E5E7EB",
        "300": "#D1D5DB",
        "400": "#9CA3AF",
        "500": "#6B7280",
        "600": "#4B5563",
        "700": "#374151",
        "800": "#1F2937",
        "900": "#111827",
        "950": "#030712"
      }
    },
    "semantic": {
      "canvas": "#F9FAFB",
      "surface": "#FFFFFF",
      "surfaceMuted": "#F3F4F6",
      "text": "#111827",
      "textMuted": "#4B5563",
      "textDisabled": "#9CA3AF",
      "border": "#E5E7EB",
      "borderStrong": "#D1D5DB",
      "primary": "#2563EB",
      "primaryHover": "#1D4ED8",
      "primaryActive": "#1E40AF",
      "onPrimary": "#FFFFFF",
      "focus": "#2563EB",
      "overlay": "rgba(3,7,18,0.56)",
      "success": {
        "surface": "#F0FDF4",
        "text": "#166534",
        "border": "#86EFAC",
        "base": "#16A34A"
      },
      "warning": {
        "surface": "#FFFBEB",
        "text": "#92400E",
        "border": "#FCD34D",
        "base": "#D97706"
      },
      "danger": {
        "surface": "#FEF2F2",
        "text": "#991B1B",
        "border": "#FCA5A5",
        "base": "#DC2626"
      },
      "info": {
        "surface": "#F0F9FF",
        "text": "#075985",
        "border": "#7DD3FC",
        "base": "#0284C7"
      },
      "transparent": "transparent",
      "hoverSurface": "#F3F4F6",
      "activeSurface": "#E5E7EB",
      "controlBorder": "#6B7280",
      "disabledSurface": "#F3F4F6",
      "disabledText": "#9CA3AF",
      "disabledBorder": "#E5E7EB",
      "dangerHover": "#B91C1C",
      "dangerActive": "#991B1B",
      "onDanger": "#FFFFFF",
      "selectedSurface": "#EFF6FF",
      "selectedHover": "#DBEAFE",
      "selectedActive": "#BFDBFE",
      "selectedText": "#1D4ED8",
      "navigationSurface": "#FFFFFF",
      "navigationText": "#374151"
    }
  },
  "spacing": {
    "0": "0px",
    "1": "4px",
    "2": "8px",
    "3": "12px",
    "4": "16px",
    "5": "20px",
    "6": "24px",
    "8": "32px",
    "10": "40px",
    "12": "48px",
    "16": "64px"
  },
  "radius": {
    "xs": "4px",
    "sm": "6px",
    "md": "8px",
    "lg": "12px",
    "xl": "16px",
    "full": "9999px"
  },
  "typography": {
    "fontFamily": {
      "sans": "Inter, system-ui, sans-serif",
      "mono": "ui-monospace, monospace"
    },
    "display": {
      "fontSize": "32px",
      "lineHeight": "40px",
      "fontWeight": 600
    },
    "h1": {
      "fontSize": "28px",
      "lineHeight": "36px",
      "fontWeight": 600
    },
    "h2": {
      "fontSize": "24px",
      "lineHeight": "32px",
      "fontWeight": 600
    },
    "h3": {
      "fontSize": "20px",
      "lineHeight": "28px",
      "fontWeight": 600
    },
    "h4": {
      "fontSize": "18px",
      "lineHeight": "26px",
      "fontWeight": 600
    },
    "bodyLg": {
      "fontSize": "16px",
      "lineHeight": "24px",
      "fontWeight": 400
    },
    "body": {
      "fontSize": "14px",
      "lineHeight": "20px",
      "fontWeight": 400
    },
    "bodyMedium": {
      "fontSize": "14px",
      "lineHeight": "20px",
      "fontWeight": 500
    },
    "small": {
      "fontSize": "13px",
      "lineHeight": "18px",
      "fontWeight": 400
    },
    "caption": {
      "fontSize": "12px",
      "lineHeight": "16px",
      "fontWeight": 400
    },
    "overline": {
      "fontSize": "11px",
      "lineHeight": "16px",
      "fontWeight": 600
    }
  },
  "icon": {
    "family": "Lucide",
    "xs": "12px",
    "sm": "16px",
    "md": "20px",
    "lg": "24px",
    "xl": "32px",
    "strokeWidth": 2
  },
  "control": {
    "height": {
      "sm": "32px",
      "md": "40px",
      "lg": "44px"
    },
    "hitArea": {
      "minimum": "40px",
      "preferred": "44px"
    },
    "focusRing": {
      "width": "2px",
      "offset": "2px"
    }
  },
  "elevation": {
    "none": "none",
    "sm": "0 1px 2px rgba(3,7,18,0.08)",
    "md": "0 8px 24px rgba(3,7,18,0.12)",
    "lg": "0 20px 48px rgba(3,7,18,0.18)"
  },
  "motion": {
    "duration": {
      "fast": "120ms",
      "normal": "180ms",
      "slow": "240ms"
    },
    "easing": {
      "standard": "cubic-bezier(0.2,0,0,1)",
      "exit": "cubic-bezier(0.4,0,1,1)"
    }
  },
  "layer": {
    "base": 0,
    "sticky": 100,
    "dropdown": 200,
    "overlay": 300,
    "modal": 400,
    "notification": 500
  },
  "component": {
    "button": {
      "sm": {
        "height": "32px",
        "paddingX": "12px",
        "gap": "8px",
        "fontSize": "13px",
        "lineHeight": "18px",
        "fontWeight": 500,
        "iconSize": "16px",
        "radius": "8px"
      },
      "md": {
        "height": "40px",
        "paddingX": "16px",
        "gap": "8px",
        "fontSize": "14px",
        "lineHeight": "20px",
        "fontWeight": 500,
        "iconSize": "16px",
        "radius": "8px"
      },
      "lg": {
        "height": "44px",
        "paddingX": "20px",
        "gap": "8px",
        "fontSize": "14px",
        "lineHeight": "20px",
        "fontWeight": 500,
        "iconSize": "20px",
        "radius": "8px"
      }
    },
    "input": {
      "sm": {
        "height": "32px",
        "paddingX": "10px",
        "fontSize": "13px",
        "lineHeight": "18px",
        "iconSize": "16px"
      },
      "md": {
        "height": "40px",
        "paddingX": "12px",
        "fontSize": "14px",
        "lineHeight": "20px",
        "iconSize": "16px"
      },
      "lg": {
        "height": "44px",
        "paddingX": "14px",
        "fontSize": "14px",
        "lineHeight": "20px",
        "iconSize": "20px"
      },
      "radius": "8px",
      "borderWidth": "1px"
    },
    "select": {
      "menu": {
        "offset": "4px",
        "paddingY": "4px",
        "optionHeight": "36px",
        "optionPaddingX": "12px",
        "optionGap": "8px",
        "maxHeight": "320px",
        "radius": "8px"
      }
    },
    "card": {
      "padding": {
        "sm": "16px",
        "md": "24px",
        "lg": "32px"
      },
      "radius": "12px",
      "borderWidth": "1px",
      "headerGap": "20px",
      "footerGap": "20px"
    },
    "modal": {
      "width": {
        "sm": "400px",
        "md": "560px",
        "lg": "720px",
        "xl": "960px"
      },
      "radius": "12px",
      "headerMinHeight": "64px",
      "footerMinHeight": "72px",
      "bodyPadding": "24px",
      "footerPadding": "16px 24px",
      "actionGap": "8px"
    },
    "table": {
      "headerHeight": "44px",
      "rowHeight": {
        "compact": "40px",
        "default": "48px",
        "comfortable": "56px"
      },
      "cellPaddingX": "12px",
      "bodyFont": "13px/18px",
      "headerFont": "600 12px/16px",
      "checkboxSize": "16px",
      "actionIconSize": "16px"
    },
    "selection": {
      "controlSize": "16px",
      "switchWidth": "36px",
      "switchHeight": "20px",
      "switchThumb": "16px",
      "segmentedHeight": "40px",
      "segmentedPadding": "4px",
      "groupGap": "4px"
    },
    "badge": {
      "minHeight": "24px",
      "paddingX": "8px",
      "gap": "4px",
      "radius": "9999px",
      "font": "500 12px/16px",
      "iconSize": "12px"
    },
    "alert": {
      "padding": "16px",
      "gap": "12px",
      "radius": "8px",
      "borderWidth": "1px",
      "iconSize": "20px",
      "actionGap": "8px"
    },
    "drawer": {
      "width": {
        "sm": "320px",
        "md": "400px",
        "lg": "480px"
      },
      "padding": "24px",
      "headerMinHeight": "64px",
      "footerMinHeight": "72px"
    },
    "tooltip": {
      "maxWidth": "320px",
      "padding": "8px 12px",
      "radius": "6px",
      "font": "400 12px/16px",
      "offset": "8px"
    },
    "menu": {
      "minWidth": "180px",
      "maxWidth": "320px",
      "padding": "4px",
      "itemHeight": "36px",
      "itemPaddingX": "12px",
      "itemGap": "8px",
      "radius": "8px"
    },
    "tabs": {
      "height": "40px",
      "gap": "4px",
      "paddingX": "12px",
      "indicatorHeight": "2px"
    },
    "pagination": {
      "itemSize": "32px",
      "gap": "4px",
      "iconSize": "16px"
    },
    "navigation": {
      "itemHeight": "40px",
      "itemPaddingX": "12px",
      "itemGap": "12px",
      "sectionGap": "24px",
      "breadcrumbGap": "8px",
      "breadcrumbIconSize": "16px"
    },
    "feedback": {
      "spinner": {
        "sm": "16px",
        "md": "24px",
        "lg": "32px"
      },
      "progressHeight": "8px",
      "skeletonRadius": "8px",
      "emptyStateMaxWidth": "480px"
    },
    "avatar": {
      "sm": "24px",
      "md": "32px",
      "lg": "40px",
      "xl": "64px"
    },
    "file": {
      "dropzonePadding": "24px",
      "itemMinHeight": "48px",
      "previewSize": "48px",
      "itemGap": "12px"
    }
  },
  "composition": {
    "formField": {
      "labelGap": "6px",
      "helperGap": "6px",
      "labelFont": "500 13px/18px",
      "helperFont": "400 12px/16px",
      "verticalGap": "20px",
      "horizontalGap": "16px"
    },
    "formSection": {
      "titleDescriptionGap": "4px",
      "descriptionGridGap": "20px",
      "sectionGap": "32px",
      "columnGap": "16px",
      "rowGap": "20px"
    },
    "pageHeader": {
      "breadcrumbGap": "12px",
      "descriptionGap": "8px",
      "actionGap": "8px",
      "contentGap": "24px"
    },
    "filterBar": {
      "controlGap": "12px",
      "groupGap": "16px",
      "contentGap": "16px"
    },
    "dataTableLayout": {